ID;rating;creationDate;user;reviewText;product_ID;product_product
4dff0a26-1725-4724-8cc9-4e464a71455e;3;2016-12-04;;Abhorreant eloquentiam eam, vis natum solet et. Te mollis equidem liberavisse ius, in ius iudico eirmod option. Atqui errem clita eu ius. Tantas dictas id mei, ad pro commodo urbanitas. No consulatu theophrastus pri. Id eleifend evertitur vulputate duo, ex labores salutandi his. Nulla elitr oratio ut usu, qui interesset necessitatibus ut. Sea cu deleniti indoctum persecuti, agam eligendi sit ei. An vis civibus offendit incorrupte, mel ne dicam corrumpit. An qui prompta aliquid.;ff7ddbc5-2490-4a19-8484-6ed026964b9a;HT-2001
b400f3d9-c53e-4d6c-8ba2-ab07204a76b0;4;2016-12-03;Pascale Monty-Demers;Animal abhorreant eloquentiam eam, vis natum solet et. Te mollis equidem liberavisse ius, in ius iudico eirmod option. Atqui errem clita eu ius. Tantas dictas id mei, ad pro commodo urbanitas. No consulatu theophrastus pri. I.;ff7ddbc5-2490-4a19-8484-6ed026964b9a;HT-2001
849c14ee-f234-4111-a284-ca7ef06b08e4;4;2016-12-03;;Eirmod option. Atqui errem clita eu ius. Tantas dictas id mei, ad pro commodo urbanitas. No consulatu theophrastus pri. Id eleifend evertitur vulputate duo, ex labores salutandi his. Nulla elitr oratio ut usu, qui interesset necessitatibu.;ff7ddbc5-2490-4a19-8484-6ed026964b9a;HT-2001
4169cf19-ca15-4a8f-89c0-8fa8606b755d;3;2016-12-03;Leah Aachen;Te mollis equidem liberavisse ius, in ius iudico eirmod option. Atqui errem clita eu ius. Tantas dictas id mei, ad pro commodo urbanitas. No consulatu theophrastus pri. Id eleifend evertitur vulputate duo, ex labores salutandi his.;ff7ddbc5-2490-4a19-8484-6ed026964b9a;HT-2001
df9d9722-ab9b-4c01-ab53-b3ba615b4d80;1;2016-12-02;;Ius, in ius iudic.;ff7ddbc5-2490-4a19-8484-6ed026964b9a;HT-2001
fba5e8e8-e1bc-4124-a057-297eaf17bb7a;3;2016-12-03;Isabel Nemours;Quo. Nam no essen.;ff7ddbc5-2490-4a19-8484-6ed026964b9a;HT-2001
e600285f-bcaa-43bc-89dc-8f7a4889b784;3;2016-12-02;Sebastien Frati;Dolor sit amet, a.;ff7ddbc5-2490-4a19-8484-6ed026964b9a;HT-2001
76dc70bb-0c8a-48ed-a20d-74d05e781bb0;4;2016-12-02;Lisa Felske;Qui qualisque deseruisse id.;ff7ddbc5-2490-4a19-8484-6ed026964b9a;HT-2001
acd5b3f8-39c7-4f87-950f-ce2393bd7ed3;1;2016-12-02;;Dolorem persecuti, qui qualisque deseruisse id, tempor dicunt rationibus et quo. Nam no essent aliquid, ne animal abhorreant eloquentiam eam, vis natum solet et. Te mollis equidem liberavisse ius, in ius iudico eirmod option. Atqui erre.;ff7ddbc5-2490-4a19-8484-6ed026964b9a;HT-2001
b51223f0-cc79-479c-a613-59165f5384a7;5'2016-12-01;Bart Koenig;Aliquid, ne animal abhorrean.;ff7ddbc5-2490-4a19-8484-6ed026964b9a;HT-2001